{
  "schemaVersion": "0.1.0",
  "revision": 2,
  "id": "rhythmic-type",
  "name": "节奏图形",
  "summary": "以歌词词语作为主要画面材料：逐词进入、累积重排、字形与词义动作共同推动整个构图，配合选择性的图形和粒子。",
  "principles": [
    "每句先找语义动作，再决定字形、图形、镜头与空间关系。",
    "强弱有对比：强句快速改变尺度与构图，停顿让观众读懂焦点。",
    "同一首歌形成自己的形状语言；动感不等于持续抖动或频闪。"
  ],
  "typography": [
    "需要逐词演出时，让唱到的词进入视觉重心；已出现的词继续缩放、移动、让位或接力，不用无关英文标签替代唱词。",
    "关键字可放大、拆分、折叠、聚散或变成空间；字体大小根据语义重要性变化。",
    "保持主体字可辨认；副歌词与辅助线条应让位给主体。"
  ],
  "composition": [
    "交替使用极大字形、留白、局部特写和全幅图形；不要连续居中套版。",
    "用字形轮廓、线、几何体或插画动作形成一个明确的视觉事件。"
  ],
  "color": [
    "根据歌曲选择少量强对比颜色；粒子和强调色只用于有目的的节奏事件。"
  ],
  "motion": [
    "让词语在同一构图中累积、重排、改变关系；在重点词和语义转折处才推动整页变形或换景。",
    "使用自然加减速、预备、回弹和物件接力衔接画面。",
    "在真实强音或语义爆发时改变规模、方向或形态；粒子只在部分事件出现。"
  ],
  "rhythm": [
    "优先使用可靠词级数据；只有行级 LRC 时，可借助真实 ASR 词边界制作明确标注的编辑动效时间，不能宣称已验证逐字对齐。没有词级依据时不要等分句子伪造时间。",
    "从真实音频提取能量和声学起音，结合歌词时间安排变化；声学起音不冒充人工核验的拍点。",
    "在强句内可有连续动作和次级变化，但要留出阅读与呼吸。"
  ],
  "semantics": [
    "词义可以直接改变字形行为：躲对应遮挡、逃对应位移、绕对应路径、接住对应落下与承托；具体实现按新歌词原创。",
    "把接住、离开、靠近、躲避、展开等动词变成可见的运动和关系。",
    "重新设计当前歌曲的图形隐喻，不固定使用示例中的心形、纸飞机或词语。"
  ],
  "transitions": [
    "通过形状变换、方向延续、遮罩、字形碎片或图形接力衔接；避免随机硬切特效。"
  ],
  "avoid": [
    "不固定配色、字体、镜头时长或镜头数；不把参考画面逐镜复刻。",
    "不要全程撒粒子、每拍缩放或把所有歌词等分成假逐字动画。",
    "识别不清的歌词必须标记待确认；可先做语义关键字，不伪造整句字幕。"
  ],
  "provenance": {
    "kind": "reference-analysis",
    "sourceLabel": "Visual rhythm study: https://www.bilibili.com/video/BV1ptad65ES9/ ; Additional word-performance studies: https://www.bilibili.com/video/BV1Haaq6ZEei/ ; https://www.bilibili.com/video/BV1uTpU6GEHw/",
    "visualCoverage": "continuous",
    "audioCoverage": "signal-only",
    "lyricsCoverage": "not-provided",
    "limitations": [
      "参考 43.886 秒连续播放并检查若干关键帧，非逐帧与主观试听验证。",
      "可复用的是语义、尺度与节奏原则；参考歌曲与画面不随安装包分发。",
      "新增参考 A 连续观察 0–31.10 秒，参考 B 完整播放 0–44.373 秒，并检查选定关键帧；未声称逐帧审查或主观试听。"
    ]
  }
}
