{
  "schemaVersion": "0.1.0",
  "id": "kinetic-play",
  "revision": 1,
  "name": "字形游乐场",
  "summary": "让文字像有重量的演员，用尺度、距离和材料变化表达新歌词的关系。",
  "principles": ["词义决定动作，清楚的视觉重心优先于同时堆叠特效", "安静和密集形成节奏反差，不把每句歌套进同一镜头"],
  "typography": ["可混合粗重字形、衬线与字符材料，依据语言与情绪选择", "大字与小字有明确层级；字体不是固定清单"],
  "composition": ["用角色之间的距离、朝向、遮挡和留白呈现关系", "允许重心偏移和大胆尺度变化，重要词在关键时刻仍能辨认"],
  "color": ["颜色有情绪和角色职责，具体色值由新歌决定"],
  "motion": ["动作可包含预备、加速、碰撞、回弹和停留", "每个动作只强调当前词义或情绪，不要求所有文字持续运动"],
  "rhythm": ["结合人声短语、重音和音乐段落，拍点是线索而非剪辑命令"],
  "semantics": ["靠近可改变角色距离，失去可抽离字形，连接可让独立元素形成关系", "这些是编排思路，不是有限动词词典或固定镜头"],
  "transitions": ["从上一段的轮廓、物件或运动方向找到下一段起点，也允许有意义的硬切"],
  "avoid": ["固定一行歌词一镜", "把同一种终端界面、配色或入场动作贯穿全片", "直接复制来源参考的镜头与时间轴"],
  "provenance": {
    "kind": "authored",
    "sourceLabel": "本项目原创的协议说明示例；并非对某段视频的观察结果",
    "visualCoverage": "not-observed",
    "audioCoverage": "not-observed",
    "lyricsCoverage": "not-provided",
    "limitations": ["这是一份创作原则示例，不包含参考证据，也不声称已观看或试听任何来源"]
  },
  "observations": []
}
