{
  "schemaVersion": "0.1.0",
  "id": "poetry",
  "revision": 3,
  "name": "流动诗境",
  "summary": "以纸墨、留白与流体形态讲述歌词中的情绪和关系，让材料与构图成为主角；文字可以只是少量题记，也可以省略。",
  "principles": ["从新歌的情绪、动作和人物关系出发，设计墨流、纸张与光的变化", "画面依靠材料形态、空间关系和留白成立，文字是可选手段", "速度、疏密和停顿服从新歌；诗意既可以舒展，也可以迅速而有冲力"],
  "typography": ["文字可以成为少量题记、沿形体展开的小字或安静的旁白，不必有主标题", "需要强调词语时，再选择适合语言的衬线、手写或其他字体；让字号与材料和留白的关系有理由", "出现的文字保留完整字形和可读落点；拉丁文字优先保持单词完整"],
  "composition": ["用墨流的聚散、纸张的层次、形态之间的距离和大片留白建立重心", "允许偏心、近景、远景和疏密变化；让主要材料占据足够尺度，画面在没有大字时仍能表达内容", "纸边、墨迹和光参与承接、遮挡、穿行、牵引或转化，成为叙事中的可见关系"],
  "color": ["以有细微肌理的浅纸色承托深墨，选择少量朱砂、灰紫或暖金作为情绪角色", "颜色应随新歌的情感而改变，不固定色值或固定明暗顺序"],
  "motion": ["让墨的渗透、汇流和断开，纸的翻折、卷动与撕合，或其他材料变化表现歌词中的动词和关系", "按歌曲选择流动长镜头、迅速重构、扫动或短暂停留，动作保留重量、柔韧和适度不规则", "镜头可以穿过材料、追随流向或改变观看尺度，运动方向承接下一构图"],
  "rhythm": ["根据真实歌词时间和实际可用的音乐依据组织动作；快歌允许短语内多次变化，舒展段落可以留长呼吸", "已有词级时间才支持精确的词级强调；音频能量变化和额外镜头动作应如实说明其依据"],
  "semantics": ["用新歌词中的情绪、动作和关系寻找可见意象，让材料变化推进内容，而非依靠重复大字解释每句", "意象可以具象或抽象，按新歌重新设计；不预设固定段落、道具或动词与特效的对应表"],
  "transitions": ["让同一条流向、纸边、墨色或光的关系跨过段落并改变作用", "可以迅速翻折、掠过镜头、溶接或改变明暗，衔接方式服从当前意象和音乐"],
  "avoid": ["把大字居中标题卡当作每段默认构图", "用慢速平移和几片漂浮纸张承担整条作品", "每段都用同一种粒子入场或同一种飘动纸片", "墨迹和光只作背景而与歌词无关", "字幕侵入主视觉或为了冲力牺牲可读性", "复制演示的镜头数量、时长、意象顺序或特定道具"],
  "provenance": {
    "kind": "authored",
    "sourceLabel": "Lyric Motion 原创方向：流动诗境",
    "visualCoverage": "not-observed",
    "audioCoverage": "not-observed",
    "lyricsCoverage": "not-provided",
    "limitations": ["这是一份可迁移的原创创作方向，不是对参考视频的观察记录，也不包含歌词或固定镜头时间"]
  },
  "observations": []
}
