{
  "schemaVersion": "0.1.0",
  "id": "storybook",
  "revision": 2,
  "name": "故事手绘",
  "summary": "让有连续身份的人物、手绘场景与具体动作演出歌词；用快速而自然的镜头连接情绪和因果。",
  "principles": ["先从歌词中寻找人物、处境、动词和关系，再设计画面；插画叙事承担视觉主体", "用户指定主角时保持其设定；没有指定时按歌曲自行选择连贯角色，不要求先填写角色表", "人物外形、衣服、代表色、道具和空间方向在镜头之间保持连续，让观众看懂谁在做什么", "手绘可以有清楚的速度与冲力：快速转场和短暂停留共同服务歌曲"],
  "typography": ["歌词作为场景中的小注释或底部字幕，不用大标题替代应当发生的故事", "原文与翻译保持职责和空间距离，字形、线条和纸张气质统一，阅读时机来自真实歌词时间"],
  "composition": ["用人物全景、关系中景和手、脸、物件的特写交替建立故事，保留一个清楚的视觉重心", "让前景、角色、远景形成层次；可以平移、推拉和遮挡，但人物的关键动作须完整可见"],
  "color": ["从纸色、深墨和少量角色色建立整套作品的材料关系，色彩随情绪变化", "夜景与亮景可有强烈反差，但通过光源、轮廓、承接物和运动方向保持连续"],
  "motion": ["使用稳定的手绘轮廓、笔触和少量细微不规则；避免每一帧随机抖动造成闪烁", "用表情、视线、手势、身体重心和物体互动建立准备、动作、回应的可读过程；镜头运动不能替代人物表演", "根据动词设计有因果的动作，并为新歌词重新寻找意象；歌词不必一行对应一镜", "让同一个动作、道具或视线在切换中继续，关键姿态有足够辨识时间，再进入下个变化"],
  "rhythm": ["跟随可核验的歌词短语、重音和音乐段落组织镜头，在需要时快速重构画面并留出阅读和情绪落点", "镜头动作可以在一句歌词中发生多次，但不要把自行设计的编辑节奏宣称为词级对齐或节拍检测结果"],
  "semantics": ["将抽象感受转换为人物能经历的空间变化、身体动作和关系，例如空间压迫、看到出口、失去支撑、被另一个人接住", "这些例子不是固定的词与特效映射，新作品应根据自己的歌词重新设计故事"],
  "transitions": ["让前一镜的轮廓、动作方向、光线或具体物件在后一镜改变角色，快速切换仍然可追踪", "遮挡、掠过、推近和形状承接各有用途，不把整条作品做成连续同一种翻页"],
  "avoid": ["静态插画加缓慢缩放承担整条作品", "用大段文字和装饰粒子代替人物、场景和语境", "每句歌词独立换一张毫无联系的图", "沿用参考中的角色造型、服饰、道具和具体分镜", "为制造手绘感而随机闪烁、不断晃动所有轮廓", "字幕覆盖人物表情、手部动作或主体轮廓"],
  "provenance": {
    "kind": "authored",
    "sourceLabel": "Lyric Motion 原创方向：故事手绘",
    "visualCoverage": "not-observed",
    "audioCoverage": "not-observed",
    "lyricsCoverage": "not-provided",
    "limitations": ["这是一份可迁移的原创创作方向，不是参考视频的观察记录，不含参考角色、固定分镜或歌词"]
  },
  "observations": []
}
